<?xml version="1.0" encoding="UTF-8"?>
<dailyMarketDataReport xmlns:xsi="http://www.w3.org/2001/XMLSchema-instance" xsi:noNamespaceSchemaLocation="dmdr-20250331.xsd">
  <version>2</version>
  <sbsef>SPECIMEN SEF INC.</sbsef>
  <date>2024-03-29</date>
  <generated>2024-03-29T14:49:20+00:00</generated>
  <sbsTnr>
    <sbsNm>SECURITY BASED SWAP 1</sbsNm>
    <tenor>P5Y</tenor>
    <ccy>USD</ccy>
    <prcFrmt>BdPricPctg</prcFrmt>
    <tradCnt>227500000</tradCnt>
    <ttlNtnlAmtTraddUsd>227500000000000</ttlNtnlAmtTraddUsd>
    <ttlNtnlAmtBlckTradsUsd>113750000000000</ttlNtnlAmtBlckTradsUsd>
    <opngPrc>314</opngPrc>
    <clsgPrc>314.2</clsgPrc>
    <sttlmPrc>314.16</sttlmPrc>
    <lwstPrc>-314</lwstPrc>
    <lwstPrcTyp>O</lwstPrcTyp>
    <hgstPrc>314.2</hgstPrc>
    <hgstPrcTyp>S</hgstPrcTyp>
  </sbsTnr>
  <sbsTnr>
    <sbsNm>SECURITY BASED SWAP 2</sbsNm>
    <upi>1234567890AB</upi>
    <tenor>P5Y</tenor>
    <ccy>GBP</ccy>
    <prcFrmt>SprdBsisPts</prcFrmt>
    <tradCnt>56000000</tradCnt>
    <ttlNtnlAmtTraddUsd>56000000000000</ttlNtnlAmtTraddUsd>
    <ttlNtnlAmtBlckTradsUsd>28000000000000</ttlNtnlAmtBlckTradsUsd>
    <opngPrc>54.625</opngPrc>
    <clsgPrc>54.625</clsgPrc>
    <lwstPrc>54.625</lwstPrc>
    <lwstPrcTyp>O</lwstPrcTyp>
    <hgstPrc>54.625</hgstPrc>
    <hgstPrcTyp>B</hgstPrcTyp>
  </sbsTnr>
  <sbsTnr>
    <sbsNm>SECURITY BASED SWAP 3</sbsNm>
    <tenor>P5Y</tenor>
    <ccy>EUR</ccy>
    <prcFrmt>SprdDcml</prcFrmt>
    <tradCnt>30000000</tradCnt>
    <ttlNtnlAmtTraddUsd>30000000000000</ttlNtnlAmtTraddUsd>
    <ttlNtnlAmtBlckTradsUsd>15000000000000</ttlNtnlAmtBlckTradsUsd>
    <opngPrc>54.5</opngPrc>
    <clsgPrc>54.5</clsgPrc>
    <lwstPrc>54.5</lwstPrc>
    <lwstPrcTyp>O</lwstPrcTyp>
    <hgstPrc>54.5</hgstPrc>
    <hgstPrcTyp>S</hgstPrcTyp>
  </sbsTnr>
  <sbsTnr>
    <sbsNm>SECURITY BASED SWAP 4</sbsNm>
    <tenor>P18M</tenor>
    <ccy>RMB</ccy>
    <prcFrmt>BdPricPctg</prcFrmt>
    <tradCnt>40000000</tradCnt>
    <ttlNtnlAmtTraddUsd>40000000000000</ttlNtnlAmtTraddUsd>
    <ttlNtnlAmtBlckTradsUsd>20000000000000</ttlNtnlAmtBlckTradsUsd>
    <opngPrc>8.55</opngPrc>
    <clsgPrc>8.55</clsgPrc>
    <lwstPrc>8.55</lwstPrc>
    <lwstPrcTyp>S</lwstPrcTyp>
    <hgstPrc>8.55</hgstPrc>
    <hgstPrcTyp>B</hgstPrcTyp>
  </sbsTnr>
  <sbsTnr>
    <sbsNm>SECURITY BASED SWAP 5</sbsNm>
    <upi>AB1234567890</upi>
    <tenor>P30D</tenor>
    <ccy>USD</ccy>
    <prcFrmt>PrmCcy</prcFrmt>
    <tradCnt>10000000</tradCnt>
    <ttlNtnlAmtTraddUsd>10000000000000</ttlNtnlAmtTraddUsd>
    <ttlNtnlAmtBlckTradsUsd>5000000000000</ttlNtnlAmtBlckTradsUsd>
    <opngPrc>9.25</opngPrc>
    <clsgPrc>9.25</clsgPrc>
    <lwstPrc>9.25</lwstPrc>
    <lwstPrcTyp>S</lwstPrcTyp>
    <hgstPrc>9.25</hgstPrc>
    <hgstPrcTyp>S</hgstPrcTyp>
    <dscrtnryAuthrtyApld>Y</dscrtnryAuthrtyApld>
    <dscrtnryAuthrtyApldFtnt>*</dscrtnryAuthrtyApldFtnt>
  </sbsTnr>
  <sbsTnr>
    <sbsNm>SECURITY BASED SWAP 6</sbsNm>
    <tenor>P1Y1M1D</tenor>
    <ccy>GBP</ccy>
    <prcFrmt>PrmPctNtnl</prcFrmt>
    <tradCnt>80000000</tradCnt>
    <ttlNtnlAmtTraddUsd>80000000000000</ttlNtnlAmtTraddUsd>
    <ttlNtnlAmtBlckTradsUsd>40000000000000</ttlNtnlAmtBlckTradsUsd>
    <opngPrc>8.05</opngPrc>
    <clsgPrc>8.05</clsgPrc>
    <lwstPrc>8.05</lwstPrc>
    <lwstPrcTyp>S</lwstPrcTyp>
    <hgstPrc>8.05</hgstPrc>
    <hgstPrcTyp>B</hgstPrcTyp>
  </sbsTnr>
  <sbsTnr>
    <sbsNm>SECURITY BASED SWAP 7</sbsNm>
    <tenor>P6M</tenor>
    <ccy>EUR</ccy>
    <prcFrmt>FxdRateDcml</prcFrmt>
    <tradCnt>20000000</tradCnt>
    <ttlNtnlAmtTraddUsd>20000000000000</ttlNtnlAmtTraddUsd>
    <ttlNtnlAmtBlckTradsUsd>10000000000000</ttlNtnlAmtBlckTradsUsd>
    <opngPrc>10.45</opngPrc>
    <clsgPrc>10.45</clsgPrc>
    <lwstPrc>10.45</lwstPrc>
    <lwstPrcTyp>S</lwstPrcTyp>
    <hgstPrc>10.45</hgstPrc>
    <hgstPrcTyp>S</hgstPrcTyp>
  </sbsTnr>
  <sbsTnr>
    <sbsNm>SECURITY BASED SWAP 8</sbsNm>
    <tenor>P10Y</tenor>
    <ccy>RMB</ccy>
    <prcFrmt>BdPricPctg</prcFrmt>
    <tradCnt>50000000</tradCnt>
    <ttlNtnlAmtTraddUsd>50000000000000</ttlNtnlAmtTraddUsd>
    <ttlNtnlAmtBlckTradsUsd>25000000000000</ttlNtnlAmtBlckTradsUsd>
    <opngPrc>11.4</opngPrc>
    <clsgPrc>11.4</clsgPrc>
    <lwstPrc>11.4</lwstPrc>
    <lwstPrcTyp>S</lwstPrcTyp>
    <hgstPrc>11.4</hgstPrc>
    <hgstPrcTyp>B</hgstPrcTyp>
  </sbsTnr>
  <sbsTnr>
    <sbsNm>SECURITY BASED SWAP 9</sbsNm>
    <tenor>P14M</tenor>
    <ccy>USD</ccy>
    <prcFrmt>SprdDcml</prcFrmt>
    <tradCnt>15000000</tradCnt>
    <ttlNtnlAmtTraddUsd>15000000000000</ttlNtnlAmtTraddUsd>
    <ttlNtnlAmtBlckTradsUsd>7500000000000</ttlNtnlAmtBlckTradsUsd>
    <opngPrc>-8.05</opngPrc>
    <clsgPrc>-8.05</clsgPrc>
    <lwstPrc>-8.05</lwstPrc>
    <lwstPrcTyp>S</lwstPrcTyp>
    <hgstPrc>-8.05</hgstPrc>
    <hgstPrcTyp>B</hgstPrcTyp>
    <dscrtnryAuthrtyApld>Y</dscrtnryAuthrtyApld>
    <dscrtnryAuthrtyApldFtnt>**</dscrtnryAuthrtyApldFtnt>
  </sbsTnr>
  <sbsTnr>
    <sbsNm>SECURITY BASED SWAP BEARING THIS EXCEPTIONALLY LENGTHY NAME /@ ABCEDEFGHIJKMNOPQRSTUVWXYZ 0123456780</sbsNm>
    <upi>Z1Y2X3W4V5U6</upi>
    <tenor>P1Y</tenor>
    <ccy>USD</ccy>
    <prcFrmt>BdPricPctg</prcFrmt>
    <tradCnt>25000000</tradCnt>
    <ttlNtnlAmtTraddUsd>25000000000000</ttlNtnlAmtTraddUsd>
    <ttlNtnlAmtBlckTradsUsd>12500000000000</ttlNtnlAmtBlckTradsUsd>
    <opngPrc>20625</opngPrc>
    <clsgPrc>20625</clsgPrc>
    <lwstPrc>20625</lwstPrc>
    <lwstPrcTyp>S</lwstPrcTyp>
    <hgstPrc>20625</hgstPrc>
    <hgstPrcTyp>S</hgstPrcTyp>
    <dscrtnryAuthrtyApld>Y</dscrtnryAuthrtyApld>
    <dscrtnryAuthrtyApldFtnt>*</dscrtnryAuthrtyApldFtnt>
  </sbsTnr>
  <mtdUsedToDtrmnNmnlPrc>Text up to 5000 characters, method used to determine nominal price.</mtdUsedToDtrmnNmnlPrc>
  <mtdUsedToDtrmnSttlmPrc>Text up to 5000 characters, method used to determine settlement price.</mtdUsedToDtrmnSttlmPrc>
  <dscrtnExpltn>Text up to 5000 characters, explanation of discretion.</dscrtnExpltn>
  <dscrtnMnnrDesc>Text up to 5000 characters, explanation of manner discretion employed.  * First example footnote.   ** Second example footnote.</dscrtnMnnrDesc>
</dailyMarketDataReport>